_id,Category,Supporting Ministry,Community,Project,Status,Target Completion Date,Description,Result,Area,Region,Address,Postal Code,Highway / Transit Line,Estimated Total Budget,Municipal Funding,Provincial Funding,Federal Funding,Other Funding,Website,Latitude,Longitude
60,Health care,Health,Markham,Markham Stouffville Hospital Redevelopment,Complete,July 2014,"Renovating and adding a 4-storey addition to the existing facility to accommodate complex continuing care/rehabilitation, critical care, emergency, ambulatory care, maternal child, acute inpatient, mental health and surgical services; associated clinical support services; and administrative services in up-to-date facilities.  ","The redeveloped hospital will accommodate 309 acute and non-acute beds, 101,000 clinic visits and 67,715 ER visits, projected to 2015/16.  ",York,Central,381 Church St,L3P 7P3,,"$350,961,722",,Yes,,Yes,,43.884049,-79.231199
61,Health care,Health,Midland,Georgian Bay General Hospital - Acute Inpatient Mental Health Unit,Planning,May 2028,Construct a new one-storey wing to house a new inpatient mental health unit.,Improved access to a full continuum of mental health services for residents in the area.,Simcoe,Central,1112 St Andrews Dr,L4R 4P4,,0,,Yes,,Yes,,44.741921,-79.911635
62,Health care,Health,Milton,Halton Healthcare Services Corporation - Milton District Hospital Expansion,Complete,April 2017,"Construction of 4-storey patient care building of approximately 330,800 square feet","Supporting clinical programs and expanding services (e.g. critical care, maternal/child, emergency)",Halton,Central,7030 Derry Rd,L9T 7H6,,"$533,566,029",,Yes,,Yes,,43.496768,-79.870012
63,Health care,Health,Milton,Hope Place Centres - Rebuilding Hope Place Centre,Planning,September 2027,Community Health Line,"The Rebuilding Hope Place Centre is a community new build capital project at Hope Place Centres TBD site located in Halton Hills to add incremental new space of 41526 sq.ft. and add new bed capacity. The main purpose of this project is relocation to address lease expiry, to allow for program expansion, and to allow for multiple program or site aggregation. This project aims to improve  quality of clinical services, cost/time efficiency of clinical services, and safety/security. This project addresses  access to mental health & addiction services.",Halton,Central,"9605 Regional Rd 25, Milton, ON ",L9T 2X7,,0,,Yes,,Yes,,43.55764692,-79.93688012
64,Health care,Health,Mississauga,Trillium Health Partners - Credit Valley Hospital - Renovation and Expansion,Complete,August 2018,"Renovations to approximately 187,000 sq. ft. of existing hospital space to address priority clinical programs","Expanded  emergency department, critical care unit, surgical services, and diagnostic imaging department",Peel,Central,2200 Eglinton Ave W,L5M 2N1,,0,,Yes,,Yes,http://www.infrastructureontario.ca/Credit-Valley-Hospital-Priority-Areas-Redevelopment-Project/,43.559283,-79.702419
65,Health care,Health,Mississauga,Trillium Health Partners,Complete,February 2016,"Renovations at the Queensway Health Centre, Mississauga Hospital and Credit Valley Hospital sites.","Renovations to accommodate additional exam rooms, workstations and a meeting room at the Queensway Health Centre, and workstations, meeting rooms and on-call rooms at the Mississauga Hospital and Credit Valley Hospital sites.",Peel,Central,100 Queensway W2200 Eglinton Ave W150 Sherway Dr,L5B 1B8,,0,,Yes,,Yes,,43.6199134156259|43.57286800390054|43.55892035064856,-79.5236437440752|-79.60744680693284|-79.70328238825701
66,Health care,Health,Mississauga,Trillium Hospital Partners - Queensway Health Centre Redevelopment,Planning,December 2028,"The project involves the addition of a new inpatient tower at the Gilgan Family Queensway Health Centre to consolidate the majority of Complex Continuing Care and Rehabilitation services. The new tower will include space for over 350 beds, will have increase capacity for complex care and rehabilitation services.",The project addresses aging infrastructure and adds new space to allow for program and service improvement and expansion. ,Peel,Central,"150 Sherway Dr, Toronto",L5B 1B8,,0,,Yes,,Yes,,,
67,Health care,Health,Mississauga,Trillium Health Partners - Mississauga Hospital Redevelopment,Planning,September 2031,"The project involves the complete redevelopment of the Peter Gilgan Mississauga Hospital site for the expansion and consolidation of acute care services. The project includes a full replacement of the aging hospital at the Mississauga site with over 950 inpatient beds, a new and expanded Emergency Department, an increase in the number of surgical operating rooms, new advanced diagnostic imaging facilities, pharmacy and clinical laboratory.",The project addresses aging infrastructure and adds new space to allow for program and service improvement and expansion. ,Peel,Central,100 Queensway Ave. West,L5B 1B8,,0,,Yes,,Yes,,43.57185423,-79.60759483
68,Health care,Health,Mississauga,Trillium Health Partners - Mississauga Site Phase 1 Parkade Project,Under construction,To Be Determined,na,na,Peel,Central,100 Queensway Ave. West,L5B 1B8,,"$19,764,800",,Yes,,Yes,,43.57185423,-79.60759483
69,Health care,Health,Moosonee,Weeneebayko Area Health Authority - Replacement Facility,Planning,November 2030,"New hospital, and Elder Care Lodge in Moosonee and a new ambulatory care center in Moose Factory.","This project will address aging infrastructure/poor physical condition of existing facilities, by building replacement facilities that will enable the provision of culturally safe health care for clients and patients for residents in Moosonee, Moose Factory, and along the James Bay Coast",Cochrane,Northeast,5 Percy's Way,POL 1Y0,,0,,Yes,,Yes,,51.271185,-80.650871
70,Health care,Health,Moosonee,Weeneebayko Area Health Authority - Regional Safe Room Renovation,Under construction,September 2024,na,na,Cochrane,Northeast,19 Hospital Drive,POL 1W0,,"$2,691,200",,Yes,,Yes,,51.26266187,-80.59311404
71,Health care,Health,Moosonee,Weeneebayko Area Health Authority - Electrical heat Upgrade,Planning,September 2024,na,na,Cochrane,Northeast,5 Percy's Way,POL 1Y0,,0,,Yes,,,,51.271185,-80.650871
72,Health care,Health,Muskoka,Muskoka Algonquin Healthcare - Hospital Redevelopment Projects,Planning,October 2032,The Project will include a phased redevelopment of Muskoka Algonquin Healthcare's two hospital sites in Bracebridge and Huntsville.,"Enhance patient safety, meet modern standards and increase patient access to inpatient, stroke, ambulatory and emergency services.",Muskoka,Central,100 Frank Miller Dr,P1H 1H7,,0,,Yes,,Yes,,45.3269,-79.2168
73,Health care,Health,Niagara Falls,Niagara Health Systems - New South Niagara Hospital & New Welland UCC,Under construction,February 2028,Construction of a new multi-floor general acute care hospital on a greenfield site in South Niagara. The new site will replace four of Niagara Health’s existing sites.,"The project will upgrade aging infrastructure, consolidate services, and add space to allow for new bed capacity and expansion of services.",Niagara,Central,Montrose Rd & Biggar Rd,L2E 6S5,,"$3,291,696,700",,Yes,,Yes,,43.03211,-79.123543
74,Health care,Health,Oakville,Halton Healthcare Services Corporation - Oakville Trafalgar Memorial Hospital Rebuild,Complete,July 2015,New and expanded hospital to replace aging Oakville Trafalgar Memorial Hospital,"Space for up to 457 beds with future capacity to accommodate 704 beds. Expansion of services, including ambulatory care, inpatient treatment, diagnostic services, rehabilitation services, complex continuing care, and a variety of support services.",Halton,Central,3001 Hospital Gate,L6M 0L8,,0,,Yes,,Yes,http://www.infrastructureontario.ca/Oakville-Trafalgar-Memorial-Hospital/,43.450405,-79.764749
75,Health care,Health,Ottawa,Hôpital Montfort - New Orléans Family Health Hub,Complete,March 2021,"Construction of a new 96,000 square foot facility to colocate complementary services from seven hospitals and community health providers","Improved access to complementary bilingual health care services including ambulatory care, mental health, geriatric, diagnostic imaging and rehabilitation with a focus on health and wellness, chronic condition management and specialty services.  ",Ottawa,East,2225 Mer Bleue Rd,K4A 3T8,,"$75,005,900",,Yes,,Yes,,45.447,-75.499305
76,Health care,Health,Ottawa,University of Ottawa Heart Institute - Cardiac Life Support Services Renovation and Expansion,Complete,January 2020,Construction of a 6-floor addition and renovation of the current facility ,"234,000-sq. ft. of  new and renovated space to include 6 additional cardiac surgery intensive care unit beds, added operating room, 2 additional electrophysiology labs as well as new chiller/cooling towers and emergency generators",Ottawa,East,40 Ruskin St,K1Y 4W7,,"$161,521,700",,Yes,,Yes,http://www.infrastructureontario.ca/University-of-Ottawa-Heart-Institute/,45.394161,-75.720682
77,Health care,Health,Ottawa,The Ottawa Hospital - Stem Cell Program,Complete,August 2023,Renovation and expansion of space for the Stem Cell Program,"Increase in number of inpatient and day hospital beds, treatment bays, and exam rooms while reducing wait times and costly inconvenient transfers out of the country. ",Ottawa,East,501 Smyth Rd,K1H 8L6,,"$12,565,397",,Yes,,Yes,,45.401224,-75.647325
78,Health care,Health,Ottawa,Bruyère Continuing Care - Renovations,Complete,July 2017,"Renovation of 15,382 sq. ft. on the 4th floor of the Y Wing Elisabeth Bruyère Hospital (EBH) site to expand the Geriatric Day Hospital (GDH) by about 1,172 attendances for a total of 6,735 (serving an average of 30 clients per day).  ","The GDH supports the coordination and integration of Geriatric Emergency Management (GEM) in nine hospitals with geriatric and community support services, to sustain seniors in the community.",Ottawa,East,"75 Bruyère St., 4th floor",K1N 5C9,,0,,Yes,,Yes,,45.432135,-75.696194
79,Health care,Health,Ottawa,Lakeridge Health - Broader Redevelopment,Planning,December 2033,Redevelopment and expansion of one or more of Lakeridge Health’s hospital sites,Increased access to upgraded and modernized facilities to address growth and demand for services.,Ottawa,East,"1 Hospital Court, ",L1G 2B9,,0,,Yes,,Yes,,43.90564887,-78.86925145
80,Health care,Health,Ottawa,The Ottawa Hospital - Civic Campus Redevelopment,Planning,December 2031,"Redevelopment of the Ottawa Hospital's Civic Campus on a new site, including construction of a new state-of-the-art facility ","Service expansion, increased beds, increased education spaces and Improved access to upgraded and modernized facilities.",Ottawa,East,1053 Carlington Ave,K1Y 4E9,,0,,Yes,,Yes,,45.39299274,-75.72176627
81,Health care,Health,Ottawa,Dave Smith Youth Treatment Centre - Dave Smith Youth Treatment Centre Phase 2 Redevelopment,Under construction,2024,"This project will contruct of a residential home for Mental Health & Addictions treatment for youth at a new site, including living, treatment and administration space.","The project will add new space and add new bed capacity, and improve the quality of mental health & addiction services for youth.",Ottawa,East,112 Willowlea Road,K0A 1L0,,"$18,509,000",,Yes,,Yes,,45.2744254,-75.96228981
82,Health care,Health,Ottawa,The Ottawa Hospital - Independent Health Facility Hemodialysis Transition,Complete,March 2024,na,na,Ottawa,East,780 Baseline Road,K2C 3V8,,0,,,,,,45.37061729,-75.71720472
83,Health care,Health,Pembroke,Pembroke Regional Hospital Inc - Surgical Services/CSR Project,Under construction,January 2025,na,na,Renfrew,East,705 MacKay St,K8A 1G8,,"$15,539,900",,Yes,,Yes,,45.81428683,-77.10682476
84,Health care,Health,Penetanguishene,Waypoint Centre For Mental Health Care - Additional Acute Mental Health Inpatient Beds,Planning,To Be Determined,na,na,Simcoe,Central,500 Church St,L9M 1G3,,0,,Yes,,,,44.800932,-79.929501
85,Health care,Health,Petrolia,Bluewater Health - Rural Health Capital Improvement Project,Planning,October 2026,na,na,Lambton,Southwest,450 Blanche St,N0N 1R0,,0,,Yes,,Yes,,43.097078,-82.11460584
86,Health care,Health,Prince Edward County, Quinte Health Care - Prince Edward County Memorial Hospital Redevelopment,Planning,December 2027,This is a hospital replacement project in Picton adjacent to the existing facility. ,The project replaces aging infrastructure and will provide a net increase of in-patient beds to accommodate growth at the site.,Prince Edward,East,403 Picton Main St,K0K 2T0,,0,,Yes,,Yes,,44.01612682,-77.13763207
87,Health care,Health,Renfrew,Renfrew Victoria Hospital Expansion and Dialysis Centre,Complete,March 2015,New construction and renovation  across back of ER/Ambulatory Care wing,Increased hemodialysis treatment from 14 to 20 stations,Renfrew,East,499 Raglan St N,K7V 1P6,,0,,Yes,,Yes,,45.482622,-76.696722
88,Health care,Health,Sarnia,Bluewater Health - Community Hub of Addictions and Mental Health Services,Planning,November 2026,"Creation of a new facility for an Integrated Withdrawal Management Program  and addictions counselling services, using a new model of care involving community and hospital service providers.","Increased and improved service capacity for mental health and addictions services, with a new location and coordinated delivery of services between community and hospital partners.",Lambton,Southwest,"89 Norman St., ",N7T 6S3,,0,,Yes,,,,42.98254434,-82.39278474
89,Health care,Health,Sarnia,CMHA - Lambton-Kent Branch - Integrated Mental Health Project,Planning,November 2027,The project involves the co-location of CMHA Lambton-Kent services and selected Mental Health outpatient services administered by Chatham Kent Health Alliance (CKHA).,This project will result in program expansion and improved access to mental health & addiction services.,Lambton,Southwest,210 Lochiel St.,N7T 4C7,,0,,Yes,,,,42.97450889,-82.40419605
90,Health care,Health,Simcoe County,Stevenson Memorial Hospital - Redevelopment Phase 1,Planning,October 2028,"Construction of an addition to the existing facility to replace, expand and modernize inpatient beds and services, emergency services, surgical services, diagnostic services and a birthing suite.",Enhance patient safety and increase access to inpatient and critical care services.,Simcoe,Central,200 Fletcher Crescent,L9R 1W7,,0,,Yes,,Yes,,44.15608271,-79.87517453
91,Health care,Health,St. Thomas,"St. Thomas Elgin General Hospital - Expansion for Emergency, Ambulatory and Mental Health",Complete,November 2017,Construction of a new wing ,"A new 106,283 sq. ft. wing to house new acute mental health inpatient unit, mental health outpatient day hospital, plus new departments (e.g. emergency, ambulatory care) ",Elgin,Southwest,189 Elm St,N5R 5C4,,0,,Yes,,Yes,http://www.infrastructureontario.ca/St-Thomas-Elgin-General-Hospital/,42.762878,-81.180783
92,Health care,Health,St. Thomas,St Thomas Elgin General Hospital - Lab Relocation,Under construction,2024,na,na,Elgin,Southwest,189 Elm St,N5R 5C4,,"$4,475,400",,Yes,,Yes,,42.762878,-81.180783
93,Health care,Health,St. Thomas,St Thomas Elgin General Hospital - MRI Suite Redevelopment,Under construction,October 2024,na,na,Elgin,Southwest,189 Elm St,N5R 5C4,,"$6,622,100",,Yes,,Yes,,42.762878,-81.180783
94,Health care,Health,Sudbury,Health Sciences North - Bed Capacity Project,Complete,January 2024,The project will allow for conversion of the existing space at Ramsey Lake Health Centre  into new conventional patient bed spaces complete with support services. ,The project will create over 50 new patient bed spaces.,Sudbury,Northeast,"41 Ramsey Lake Road, ",P3E 5J1,,"$9,623,500",,Yes,,Yes,,46.46809364,-80.99667725
95,Health care,Health,Thunder Bay,St. Joseph's Hospital  - Expansion for Specialized Mental Health Rehabilitation,Complete,June 2018,Construction of new east wing for specialized mental health care.,38 beds added for people needing active and long-term psychiatric rehabilitation and geriatric psychiatry.,Thunder Bay,Northwest,35 North Algoma St,P7B 5G7,,0,,Yes,,Yes,,48.4381,-89.222415
96,Health care,Health,Thunder Bay,Thunder Bay Regional Health Sciences Centre - Cardiovascular Surgery Program,Planning,March 2027,"The Project involves new construction and renovation of space at Thunder Bay Regional Health Sciences Centre and includes a cardiovascular surgical inpatient unit, an additional operating room, a vascular lab and outpatient clinic.",Improved access to cardiovascular surgery and related services for residents of Thunder Bay and Northwestern Ontario.,Thunder Bay,Northwest,980 Oliver Rd,P7B 6V4,,0,,Yes,,Yes,,48.428793,-89.269491
97,Health care,Health,Thunder Bay,Thunder Bay Regional Health Sciences Centre - Linear Accelerator (LINAC) Service Expansion and Positron Emission Tomography-computed tomography (PET-CT) Relocation,Under construction,2024,na,na,Thunder Bay,Northwest,980 Oliver Rd,P7B 6V4,,"$9,297,400",,Yes,,Yes,,48.428793,-89.269491
98,Health care,Health,Thunder Bay District,Ontario Agency For Health Protection And Promotion - Thunder Bay Public Health Ontario Laboratory Leasehold Improvement Project,Planning,June 2027,na,na,Thunder Bay,Northwest,336 Syndicate Ave S,P7E 1E3,,0,,Yes,,,,48.37949611,-89.247545
99,Health care,Health,Timmins,Centre De Sante Communautaire de Timmins - New Build Project,Under construction,May 2025,Construction of a new purpose-built CHC facility to serve the Francopone population in Timmins ,"The new facility will that expand program space and services and improve access to quality primary care, mental health,  physiotherapy, dietician services, and early childhood education.",Cochrane,Northeast,120 Kent Avenue,P4N 7S4,,"$16,722,000",,Yes,,,,48.47158417,-81.33884449
100,Health care,Health,Toronto,Sunnybrook Health Sciences Centre - Off-site and On-site Dialysis Centre,Complete,January 2021,Two phase project - Off-site includes renovations to the CNIB site and the on-site component includes interior renovations to Sunnybrook's dialysis centre in the hospital at the Bayview campus.,Outpatient dialysis centre with 24 stations and hospital-based dialysis centre with 15 stations.,Toronto,Central,2075 Bayview Ave,M4N 3E5,,"$14,731,900",,Yes,,Yes,,43.721696,-79.376026
101,Health care,Health,Toronto,Casey House - New Replacement Facility,Complete,May 2017,New construction and renovations ,"Increased space for expanding residential, home and hospice services, as well as new Day Health Program for people with HIV/AIDS.",Toronto,Central,119 Isabella St,M4Y 1P2,,"$44,403,300",,Yes,,Yes,http://www.infrastructureontario.ca/Casey-House-Facility-Replacement-Project/,43.669035,-79.378269
102,Health care,Health,Toronto,Centre for Addiction and Mental Health Phase 1 C Project - New Client Care Building and Centre for Discovery and Knowledge Exchange,Complete,September 2020,Construction of two new buildings at the Queen Street site.,"Modernized facilities for improved inpatient beds, ambulatory programs and relocation of Emergency Department/Emergency Access Unit.",Toronto,Central,1001 Queen St W,M5T 1R8,,"$633,309,700",,Yes,,Yes,http://www.infrastructureontario.ca/Centre-for-Addiction-and-Mental-Health-(CAMH)-Phase-1C-Redevelopment/,43.643075,-79.417319
103,Health care,Health,Toronto,New Humber River Hospital,Complete,June 2015,Consolidating services from three locations into one,"1.8 million sq. ft.-building to become Ontario’s first digital hospital, while increasing beds from 549 to 656, expanding emergency services and more",Toronto,Central,1235 Wilson Ave,M3M 0B2,,0,,Yes,,Yes,http://www.infrastructureontario.ca/Humber-River-Hospital/,43.723951,-79.488617
104,Health care,Health,Toronto,Michael Garron Hospital - New Patient Care Tower,Under construction,October 2024,New tower for inpatient and outpatient care,"Additional beds and increased program space, and infrastructure improvement.",Toronto,Central,825 Coxwell Ave,M4C 3E7,,"$436,191,900",,Yes,,Yes,http://www.infrastructureontario.ca/Michael-Garron-Hospital-Phase-1/,43.689759,-79.325922
105,Health care,Health,Toronto,"Mount Sinai Hospital - Surgery, Critical Care and Emergency Room Renovation",Under construction,2024,"The project is a large-scale renovation of key areas of the Mount Sinai Hospital, including Critical Care Unit; expansion and redesign of the Emergency Department, Operating Rooms and Surgical Services. ","Additional beds and increased program space, and infrastructure improvement.",Toronto,Central,600 University Ave,M5G 1X5,,"$388,067,600",,Yes,,Yes,http://www.infrastructureontario.ca/Mount-Sinai-Hospital-Phase-3A-Redevelopment-Project/,43.657456,-79.390347
106,Health care,Health,Toronto,Unity Health Toronto - St. Michael's Hospital Patient Care Tower,Under construction,October 2025,"Construction of a 17-storey tower and renovation of 150,000 square feet of existing space","Replacing undersized, outdated patient rooms; adding 5 state-of-the-art operating rooms and space for ambulatory and ophthalmology clinics",Toronto,Central,30 Bond St,M5B 1W8,,"$350,550,900",,Yes,,Yes,http://www.infrastructureontario.ca/St-Michaels-Hospital/,43.65367,-79.377729
107,Health care,Health,Toronto,The Salvation Army Toronto Grace Health Centre Infrastructure Upgrades,Complete,June 2017,"Upgrades to more than 70,000 sq. ft. to TGHC and renovations to more than 50,000 sq. ft. of space at UHN Hillcrest","Improvements to air quality for patients and staff, safety in patient rooms, washrooms and showers; patients will be able to find and use programs and services more easily",Toronto,Central,650 Church St,M4Y 2G5,,"$28,598,567",,Yes,,Yes,http://www.torontograce.org/about-tghc/our-present/,43.670326,-79.383202
108,Health care,Health,Toronto,University Health Network - Bickle Centre Infrastructure Upgrades ,Complete,April 2020,"Renovations including mould remediation, improvements to lighting and millwork in patient rooms and nursing stations, as well as the installation of medical gases and suction units to the bedside","Access to medical gas and suction outlets at all 224 beds, improved accessibility in washrooms, and upgraded fire safety, electrical, mechanical and structural systems",Toronto,Central,130 Dunn Ave,M5G 2C4,,"$24,456,800",,Yes,,Yes,,43.634803,-79.432709
109,Health care,Health,Toronto,West Park Healthcare Centre - DBFM Brownfield Capital Redevelopment Project,Complete,September 2023,Construction of a new multi-storey building to replace old building,"Increased capacity for inpatient, ambulatory care, outreach, diagnostic and therapeutic services with a capacity of up to 314 beds (up to a 54-bed increase) upon opening.",Toronto,Central,82 Buttonwood Ave,M6M 2J5,,"$1,030,418,700",,Yes,,Yes,http://www.infrastructureontario.ca/West-Park-Healthcare-Centre/,43.690044,-79.508181
110,Health care,Health,Toronto,William Osler Health System - Etobicoke General Hospital New Patient Tower,Complete,February 2019,Construction of a new four-storey tower,"Improved emergency department, critical care services and various ambulatory and support services.  ",Toronto,Central,101 Humber College Blvd,M9V 1R8,,"$358,320,300",,Yes,,Yes,http://www.infrastructureontario.ca/Etobicoke-General-Hospital-Redevelopment-Phase1/,43.729423,-79.598176
111,Health care,Health,Toronto,New Women's College Hospital (Rebuild),Complete,September 2015,Construction of a new building at the Grenville Street site,"Services from 3 different locations concentrated in new location, while a new Centre of Excellence in Women’s Health will be created in a 630,000-sq. ft. building",Toronto,Central,76 Grenville St,M5S 1B2,,0,,Yes,,Yes,http://www.infrastructureontario.ca/Womens_College_Hospital/,43.661621,-79.387636
112,Health care,Health,Toronto,Scarborough Health Network - Diagnostic Imaging Project,Under construction,July 2024,This project involves renovations at the Scarborough Health Network’s General Campus to expand and consolidate diagnostic imaging services and construction of a modernized Operating Room.,Improved and expanded access to modernized diagnostic imaging services and surgical services.,Toronto,Central,3050 Lawrence Ave E,M1P 2V5,,"$36,604,600",,Yes,,Yes,,43.756193,-79.246939
113,Health care,Health,Toronto,University Health Network Princess Margaret Cancer Centre,Complete,May 2020,"Creation of additional inpatient allogenic stem cell transplant beds, expanded pharmacy services and creation of laboratory facilities. ","Increased inpatient capacity for allogenic stem cell transplant (STC), expanded pharmacy  services to support growth in SCT, and creation of a laboratory facility to meet provincial wait time standards.",Toronto,Central,610 University Ave,M5G 2M9,,"$9,890,900",,Yes,,Yes,http://www.uhn.ca/PrincessMargaret,43.658248,-79.390683
114,Health care,Health,Toronto,St. Joseph's Healthcare (Toronto) - Phase 3 and 4 Redevelopment,Complete,March 2014,This project is the final phase of new construction and renovations to modernize outdated facilities for maternal/newborn service,"Addition of 2 surgical inpatient units, increased  capacity for an up to 6-bed child/adolescent mental health unit, and additional capacity for an up to 28-bed medical unit.  ",Toronto,Central,30 The Queensway,M6R 1B5,,"$103,692,217",,Yes,,Yes,,43.640457,-79.450307
115,Health care,Health,Toronto,Scarborough Health Network - Chronic Kidney Disease Facility ,Planning,June 2026,"Construction of a facility to accommodate community based chronic kidney disease programs, including dialysis as part of the Bridletowne Neighbourhood Centre","Increased access in a modern facility for patients requiring chronic kidney disease programs, including dialysis.",Toronto,Central,1251 Bridletowne Cir,M1W 0A5,,0,,Yes,,Yes,,43.794889,-79.310276
