_id,Category,Supporting Ministry,Community,Project,Status,Target Completion Date,Description,Result,Area,Region,Address,Postal Code,Highway / Transit Line,Estimated Total Budget,Municipal Funding,Provincial Funding,Federal Funding,Other Funding,Website,Latitude,Longitude
1,Health care,Health,Atikokan,Atikokan General Hospital - Renovation and Expansion,Complete,July 2017,"Renovating roughly 8,500 sq. ft. and adding roughly 10,000 sq. ft.","More space for 11 acute-care and other types of beds, as well as improved air handling, boiler and sprinkler systems",Rainy River,Northwest,120 Dorothy St,P0T 1C0,,0,,Yes,,Yes,,48.753595,-91.598441
2,Health care,Health,Barrie,The Royal Victoria Hospital of Barrie - Phase 1 Redevelopment,Complete,August 2013,Construction of  4 bunker-3 machines at the Simcoe Muskoka Regional Cancer Centre (SMRCC) and the Phase 1 redevelopment of the Royal Victoria Hospital. ,"An additional 101 inpatient beds, expanded emergency and ambulatory care, two new operating rooms as well as enhancements to related services such as laboratory and diagnostic imaging. ",Simcoe,Central,201 Georgian Dr,L4M 6M2,,"$372,605,793",,Yes,,Yes,,44.415046,-79.662803
3,Health care,Health,Barrie,Royal Victoria Regional Health Centre - PET-CT Scanner,Complete,February 2024,na,na,Simcoe,Central,201 Georgian Dr,L4M 6M2,,0,,,,,,44.415046,-79.662803
4,Health care,Health,Belleville,Quinte Healthcare Corporation Renovation,Complete,February 2017,Renovations to the medical device reprocessing department (MDRD) and central sterilization room.,"Improved infection control, and enhanced preventive maintenance capabilities.",Hastings,East,265 Dundas Street East,K8N 5A9,,0,,Yes,,Yes,,44.162698,-77.364334
5,Health care,Health,Belleville,Quinte Healthcare Corp - Trenton Expansion and Redevelopment of Emergency Department,Planning,To Be Determined,na,na,Hastings,East,242 King St,K8V 5S6,,0,,Yes,,Yes,,44.11706578,-77.57988556
6,Health care,Health,Blind River,Anishnawbe Mushkiki AHAC - N'Mninoeayaa AHAC Site,Complete,March 2015,Construct a satellite building adjacent to the existing facility,Additional file storage and meeting space in Cutler.,Algoma,Northeast,473 ON-17,P0P 1B0,,"$609,200",,Yes,,,,46.187155,-82.924852
7,Health care,Health,Bradford-West Gwillimbury,Brant Community Healthcare System - Emergency Department Expansion Project,Under construction,March 2026,"Th Emergency Department  Expansion Project includes increased space including for:  treatment bays/rooms, extended stay area; and mental health safe rooms and observation area.  Also included is renovation of the walk-in arrival area (waiting/triage/registration and security); ambulance arrival and off-loading zone; and various clinical and non-clinical support spaces.   The project also includes a new Indigenous Services Suite.  This project is the first of two sequential projects involving the ED.","Reduce ED wait times, service improvements,  and address hallway medicine.",Simcoe,Central,200 Terrace Hill St.,N3R 1G9,,"$28,376,900",,Yes,,Yes,,43.15307991,-80.27616937
8,Health care,Health,Brampton,William Osler Health System - New Peel Memorial Centre for Integrated Health and Wellness,Complete,December 2016,Construction of a new centre,"Improved urgent care, ambulatory care, clinical support and corporate administrative services in Brampton",Peel,Central,20 Lynch St,L6W 2Z8,,"$538,347,570",,Yes,,Yes,http://www.infrastructureontario.ca/Peel-Memorial-Centre-for-Integrated-Health-and-Wellness/,43.690668,-79.751022
9,Health care,Health,Brampton,William Osler Health System - Peel Memorial Centre for Integrated Health Wellness – Phase 2 Redevelopment Lynch Site,Planning,March 2030,Construction of an addition to the newly built Phase 1 facility to accommodate non-acute inpatient services including complex continuing care and rehabilitation beds. William Osler Health System is planning to provide post-acute care at Peel Memorial Hospital for patients recovering from an acute care stay before they safely return home. Bringing this specialized care to Peel Memorial will enable more acute care beds to be added to Brampton Civic Hospital. ,Service expansion and Improved access to upgraded and modernized facilities.,Peel,Central,20 Lynch St,L6W 2Z8,,0,,Yes,,Yes,,43.690271,-79.751051
10,Health care,Health,Brock,Brock Community Health Centre - New Build Project,Under construction,August 2024,"The Brock CHC  project will create a purpose built facility. The new location will consolidate services (primary health care, diabetes education, community development and health promotion and geriatric assessments) currently located at multiple sites.  This project also includes a dental program and some space for Durham Community College.","This project will allow for consolidation of services, improve operational efficiencies, and to add additional space to allow for program and service delivery expansion.",Durham,Central,64 Cameron St. E,L0E 1E0,,"$16,574,200",,Yes,,Yes,,44.35148092,-79.03584713
11,Health care,Health,Brockville,"Brockville General Hospital - Renovation and Expansion for Mental Health, Complex Continuing Care and Rehabilitation",Complete,August 2020,Consolidating services from two locations into new 4-storey tower,"32 new inpatient beds for complex continuing care, acute mental health and rehabilitation",Leeds and Grenville,East,75 Charles St,K6V 1S8,,"$159,170,500",,Yes,,Yes,http://www.infrastructureontario.ca/Brockville-General-Hospital-Redevelopment-Project/,44.598169,-75.681639
12,Health care,Health,Brockville,Kingston Health Sciences Centre - Brockville Satellite Dialysis Centre,Planning,February 2026,na,na,Leeds and Grenville,East,"555 California Ave, Suite 8",K6V 5V6,,0,,Yes,,Yes,,44.61243396,-75.69239477
13,Health care,Health,Burlington,Joseph Brant Hospital - Renovation and Expansion,Complete,August 2018,Construction of new tower and renovations to existing building,"7-storey, 414,920 sq. ft.-tower and 128.225 sq. ft. of renovated space to increase inpatient, surgical and ICU beds and to support expanded services (e.g. specialized nursery, emergency)",Halton,Central,1230 North Shore Blvd E,L7S 1W7,,0,,Yes,,Yes,http://www.infrastructureontario.ca/Joseph-Brant-Hospital/,43.317192,-79.802582
14,Health care,Health,Cambridge,Cambridge Memorial Hospital - Renovation and Expansion,Under construction,September 2024,Renovation and new acute care wing,"Additional beds and increased program space, and infrastructure improvement.",Waterloo,Southwest,700 Coronation Blvd,N1R 3G2,,"$244,064,662",,Yes,,Yes,http://www.infrastructureontario.ca/Cambridge-Memorial-Hospital/,43.378066,-80.328309
15,Health care,Health,Carleton Place,Carleton Place District Memorial Hospital - Emergency Department Redevelopment,Under construction,2024,na,na,Lanark,East,211 Lake Ave. E,K7C1J4,,"$18,200,800",,Yes,,Yes,,45.14109002,-76.13674518
16,Health care,Health,Centre Wellington,New Groves Memorial Community Hospital,Complete,February 2020,"Construction of a new hospital located in Aboyne, between Fergus and Elora","New hospital of approximately 130,000 sq ft with 45 inpatient beds",Wellington,Southwest,235 Union St E,N1M 1W3,,"$144,336,500",,Yes,,Yes,http://www.infrastructureontario.ca/Groves-Memorial-Community-Hospital/,43.705509,-80.372819
17,Health care,Health,Chatham-Kent,"Chatham-Kent Health Alliance - Emergency Department, DI and Lab Project",Planning,July 2027,"This project is part of a phased redevelopment of the Wallaceburg site as a single-storey healthcare facility with 5 beds focused on emergency services, outpatient care including rehabilitation, and diagnostic imaging, laboratory. This phase of development at Wallaceburg will be the construction of new Emergency, DI and Laboratory Departments, which will add approx. 17,000 square feet of new space.","This project will expand space for the Emergency Department, replace aging infrasturcuture and improved ER services. ",Chatham-Kent,Southwest,"325 Margaret Ave,",N8A 2A7,,0,,Yes,,Yes,,42.60908175,-82.36755745
18,Health care,Health,Clarington,Lakeridge Health - Bowmanville Site Redevelopment ,Planning,January 2030,"Renovation and expansion for the emergency department, inpatient units, and the diagnostic imaging department at the Bowmanville site.",Expanded programs and services capacity ,Durham,Central,47 Liberty St S,L1C 2N4,,0,,Yes,,Yes,,43.908842,-78.677997
19,Health care,Health,Clarington,Lakeridge Health - Bowmanville Helipad interim Relocation - Interim project to the Bowmanville Redevelopment project,Under construction,2024,na,na,Durham,Central,Haines St & Basleline rd E,L1C 4R2,,"$1,039,200",,Yes,,Yes,,43.90605788,-78.66286192
20,Health care,Health,Collingwood,Collingwood General & Marine Hospital - Hospital Redevelopment,Planning,August 2035,The project includes renovation and will add to the current Hosptial on site. will relocate the hospital to a new site. ," The project will address aging infrastructure and allow for expansion of the intensive care, inpatient care, emergency, obstetrics and the operating suite.",Simcoe,Central,"459 Hume St, Collingwood",L9Y 1W9,,0,,Yes,,Yes,,44.50005257,-80.20349273
21,Health care,Health,Cornwall,Cornwall Community Hospital,Complete,November 2014,"Construction of a wing and renovations to consolidate all acute and rehabilitation hospital services from two sites onto the McConnell Avenue site. The redevelopment includes demolition of the existing west wing to accommodate new construction for the emergency room, diagnostic imaging, surgical suite, surgical daycare, sterile processing department and mechanical room.  ","Creation of 157 acute care, 20 acute mental health and 24 rehabilitation beds.  ","Stormont, Dundas and Glengarry",East,840 McConnell Ave,K6H 5S5,,"$115,476,892",,Yes,,Yes,,45.030316,-74.718353
22,Health care,Health,Dryden,Dryden Regional Health Centre - Satellite Renal (Hemodialysis) Unit,Planning,October 2026,na,na,Kenora,Northwest,58 Goodall St,P8N 2Z6,,0,,Yes,,Yes,,49.76977892,-92.83900285
23,Health care,Health,Durham,Markham Stouffville Hospital - Uxbridge Site Redevelopment Project,Planning,June 2030,The redevelopment project at the Uxbridge site involves construction of a new facility to replace the ageing 1959 hospital.,"Enhance patient safety, meet modern standards and improve patient access to inpatient and Diagnostic Imaging services.",Durham,Central,"4 Campbell Dr,",L9P 1S4,,0,,Yes,,Yes,,44.10360858,-79.12761968
24,Health care,Health,Espanola,Espanola Regional Hospital and Health Centre Emergency Department Expansion,Complete,June 2014,Renovations  to the emergency department,Increased capacity from 5 to 11 treatment bays,Sudbury,Northeast,825 McKinnon Dr,P5E 1R4,,0,,Yes,,Yes,,46.248285,-81.783185
25,Health care,Health,Fort Frances,Gizhewaadiziwin Health Access Centre - Renovation / Expansion Project,Planning,December 2026,"This project will renovate and expand the Gizhewaadiziwin Health Access Centre in Fort Francis, to bring existing space up to current standards and allow for program expansion.","The project wil allow for program expansion and an increase in capacity for existing services.  Using of an improved model of care hub multi-service model, this project will improve access to safety/security, access to mental health and addictions services and chronic disease management care.",Rainy River,Northwest,"1460 Idylwild Dr,",P9A 3M3,,0,,Yes,,,,48.63089192,-93.35955468
26,Health care,Health,Greater Napanee,Kingston Community Health Centres - Napanee and Area Satellite,Complete,September 2016,"A 19,000 gross square foot facility at 26 Dundas Street West in Napanee. ","The CHC will offer primary health care programs and services including individual, family and group therapy and indigenous programs for its catchment population. ",Lennox and Addington,East,26 Dundas Street West,K7R 1H6,,"$6,734,200",,Yes,,,,44.246659,-76.951797
27,Health care,Health,Greater Sudbury,Health Sciences North (formerly L'Hopital Regional de Sudbury Regional Hospital) - Northern Ontario School of Medicine,Complete,November 2021,"This project will build a state-of-the-art facility to serve as a training ground for future doctors, nurses, lab technicians, paramedics and other health professionals. The project includes spaces for academic administration, meeting / learning suites and a new Simulation Lab.",New and improved space for students in Northern Ontario School of Medicine,Sudbury,Northeast,41 Ramsey Lake Rd,P3E 5J1,,"$22,826,100",,Yes,,Yes,https://www.hsnsudbury.ca/portalen/,46.467734,-80.996267
28,Health care,Health,Greater Sudbury,St Joseph's Continuing Care Centre Of Sudbury - Rehabilitation Bed Expansion Project,Under construction,November 2024,na,na,Sudbury,Northeast,Lasalle Boulevard,P3A 1W7,,"$18,195,100",,Yes,,Yes,,46.52196792,-80.97981513
29,Health care,Health,Greater Sudbury,St Joseph's Continuing Care Centre Of Sudbury - Phase Two Rehabilitation Bed Expansion Project,Planning,September 2025,na,na,Sudbury,Northeast,1140 S Bay Rd,P3E 0B6,,0,,Yes,,Yes,,46.46673544,-80.96669052
30,Health care,Health,Grey Highlands,Grey Bruce Health Services - Markdale Hospital Redevelopment,Complete,May 2023,Replacement of old hospital with new  facility.,Expansion of service and infrastructure improvement.,Grey,Southwest,55 Isla St,N0C 1H0,,"$56,462,449",,Yes,,Yes,https://www.gbhs.on.ca/,44.318169,-80.650172
31,Health care,Health,Grimsby,Hamilton Health Sciences  - West Lincoln Memorial Hospital Redevelopment Project,Under construction,February 2025,"Construction of a new facility on the existing site to provide 61 inpatient beds and allow HHS to preserve emergency, obstetric, surgical and ambulatory services in the Grimsby area in a modern setting for infection prevention and control and improved patient flow and safety. ",Service expansion and Improved access to upgraded and modernized facilities.,Niagara,Central,169 Main St E,L3M 1P3,,"$240,546,800",,Yes,,Yes,,43.18845154,-79.54188454
32,Health care,Health,Guelph,Guelph General Hospital - Emergency Mental Health & Addiction Services Renovation & ED Expansion Phase 1,Planning,April 2026,na,na,Wellington,Southwest,115 Delhi St,N1E 4J4,,0,,Yes,,Yes,,43.55658562,-80.25330569
33,Health care,Health,Hamilton,Hamilton Health Sciences Centre - McMaster University Medical Centre Renovations,Complete,May 2017,Renovations at three different locations ,"34,000 sq. ft. of renovated space between MUMC and Hamilton General Hospital; 10,600 sq. ft. renovated at existing building to house West End Urgent Care Centre",Hamilton,Central,1200 Main St W,L8N 3Z5,,"$93,237,625",,Yes,,Yes,,43.259495,-79.91747
34,Health care,Health,Hamilton,Hamilton Health Sciences Centre - Stem Cell Expansion,Complete,July 2021,"The project will provide new private rooms and related support space at the Juravinski site. The new beds will accommodate patients receiving stem cell transplants and those with acute leukemia.  The adjacent Oncology Day Services will also be renovated and expanded to new treatment spaces. Pharmacy, clinic and laboratory storage space will also be expanded or renovated. ","Additional beds and increased program space, and infrastructure improvement.",Hamilton,Central,711 Concession St,L8V 1C3,,"$25,166,200",,Yes,,Yes,,43.2399,-79.8464
35,Health care,Health,Hamilton,St. Joseph's Healthcare (Hamilton) - Centre for Mountain Health Service,Complete,December 2013,"Construction of a new facility of approximately 800,000 square feet, to support existing longer-term mental health, forensics and acute mental health programs and services, expansion of forensic services, geriatric psychiatry and mental health rehabilitation","Increased capacity of inpatient beds from 214 to up to 305 along with all associated support services; expanded outpatient clinics for psychiatry, diagnostic imaging, medical services and education, etc. ",Hamilton,Central,50 Charlton Ave E,L8N 4A6,,"$1,091,189,022",,Yes,,Yes,,43.249229,-79.870265
36,Health care,Health,Hamilton,Hamilton Health Sciences - Hamilton Redevelopment,Planning,January 2036,The project involves the redevelopment and expansion of the hospital's Juravinski site.  This project will replace and upgrade components of the hospital's existing infrastructure including extensive renovations and construction of a new patient care tower.,"Replacement of aging infrastructure, increase in number of beds and expansion of hospital programs.",Hamilton,Central,699 Concession St,L8V 5C2,,0,,Yes,,Yes,,43.571792,-79.60856
37,Health care,Health,Hamilton,De dwa da dehs nyes Aboriginal Health Centre - Phase 1: Biindigen Indigenous Well-Being Centre,Planning,January 2026,Redevelopment of a former school builiding into a healthcare and social services facility.," The Centre will allow for the centralization of primary health programs, using a mult-service delivery model, and provide complementary and culturally sensitive services.",Hamilton,Central,678 Main St E.,L8M 1K2,,0,,Yes,,Yes,,43.24903,-79.84298657
38,Health care,Health,Hamilton,De dwa da dehs nyes Aboriginal Health Centre - Phase 1: Biindigen Redevelopment Early Works,Planning,May 2025,This project will includes the demolition of the existing building on site and preparation of the site for new construction.,Preparation of site for future new facility.,Hamilton,Central,678 Main St E.,L8M 1K2,,0,,Yes,,,,43.24903,-79.84298657
39,Health care,Health,Hamilton,Hamilton Urban Core Community Health Centre - Relocation Project,Under construction,August 2024,Construction of a new purpose-built facility in Hamilton for the CHC. ,"This project will improve the quality of clinical services, allow for program expansion and improve access to mental health and addiction services.",Hamilton,Central,181 Main St W.,L8L 4S1,,"$17,362,900",,Yes,,Yes,,43.25608486,-79.84854793
40,Health care,Health,Hamilton,St Joseph's Healthcare Hamilton - St. Joseph's Villa Reactivation Care Centre,Planning,December 2025,na,na,Hamilton,Central,56 Governors Rd,L9H 5G7,,0,,Yes,,Yes,,43.26211273,-79.95808907
41,Health care,Health,Hamilton,Hamilton Health Sciences Corp - ED Renovations,Planning,October 2027,"This project involves the renovation and expansion of the Emergency Department at Hamilton General Hospital site.  The project will expand the Emergency Department into vacant adjacent space, adding approximately 3000 sq. ft. of space.  Construction will take place in 4 phases.  ","The project will increase space and improve infection control, and enhance patient/staff safety .  The renovations will also improve the efficiency of patient flow through the Emergency Department.   ",Hamilton,Central,237 Barton St E,L8L 2X2,,0,,Yes,,Yes,,43.26482429,-79.85546794
42,Health care,Health,Hamilton,St Joseph's Healthcare Hamilton - Charlton Site - Psychiatric Emergency Services Expansion,Planning,December 2025,na,na,Hamilton,Central,50 Charlton Ave E,L8N4A6,,0,,Yes,,Yes,,43.25283455,-79.87309125
43,Health care,Health,Hawkesbury,Hopital General de Hawkesbury and District General Hospital - Renovation and Expansion,Complete,December 2020,"New construction and renovations to create expanded space, services and technology","Expanded services (e.g. emergency, intensive care, diagnostic imaging, complex continuing care) and new units (e.g. acute mental health, operating room)",Prescott and Russell,East,1111 Ghislain St,K6A 3G5,,"$146,530,420",,Yes,,Yes,http://www.infrastructureontario.ca/Hawkesbury-District-General-Hospital/,45.599498,-74.607557
44,Health care,Health,Kawartha Lakes,Ross Memorial Hospital - Heating Plant and Emergency Power upgrades,Planning,March 2025,na,na,Kawartha Lakes,East,10 Angeline St N,K9V 4M8,,0,,Yes,,Yes,,44.35392389,-78.75086697
45,Health care,Health,Kenora,Waasegiizhig Nanaandawe'iyewigamig Health Access Centre - Redevelopment Project,Planning,January 2026,The project includes relocation and redevelopment to consolidate two sites into one new building in Kenora. ,"The project will allow for program expansion, and allow for multiple program or site aggregation. The project addresses chronic diseases management and access to mental health & addiction services.",Kenora,Northwest,212 4th Ave S.,P9N 1Y9,,0,,Yes,,,,49.7651494,-94.48761896
46,Health care,Health,Kincardine,South Bruce Grey Health Centre - Kincardine Site Redevelopment,Planning,June 2026,"Renovations and expansion to the emergency department, radiation decontamination/treatment room, diagnostic imaging and lab, as well as major infrastructure upgrades",Improved access to health care services for area residents,Bruce,Southwest,"21 McGivern Street West, P.O. Box 1300",N2Z 1G6,,0,,Yes,,Yes,,44.12215681,-81.15304603
47,Health care,Health,Kingston,New Providence Care Hospital,Complete,November 2016,Major redevelopment project,"Bringing mental health, rehabilitation and complex continuing care (e.g. geriatrics) into one location, with 270 inpatient beds",Frontenac,East,King St W,K7L 5A2,,0,,Yes,,Yes,http://www.infrastructureontario.ca/Providence-Care-Hospital/,44.220901,-76.517605
48,Health care,Health,Kingston,Kingston General Hospital - Redevelopment,Planning,February 2030,"The hospital redevelopment includes demolition of old buildings, extensive renovations and new construction.","Improved access to the catheterization laboratory, surgical suites, clinical laboratories, emergency department, neonatal intensive care unit, labour and delivery suite, and inpatient unit.",Frontenac,East,"76 Stuart St, Kingston",K7L 2V7,,0,,Yes,,Yes,,44.224605,-76.492877
49,Health care,Health,Kingston,Kingston Health Sciences Centre - Belleville Satellite Dialysis Unit Renovation,Planning,October 2026,na,na,Frontenac,East,"76 Stuart St, Kingston",K7L 2V7,,0,,Yes,,Yes,,44.224605,-76.492877
50,Health care,Health,Kingston,Kingston Health Sciences Centre - Kingston Offsite Dialysis Unit,Planning,August 2026,na,na,Frontenac,East,"76 Stuart St, Kingston",K7L 2V7,,0,,Yes,,Yes,,44.224605,-76.492877
51,Health care,Health,Kitchener,Grand River Hospital - Kitchener Waterloo Site Restructuring,Complete,March 2014,"Restructuring renovation and new construction project and upgrades to the intensive care unit, operating rooms and diagnostic imaging and ambulatory care departments.","Expanded acute adult mental health as well as up to 12 new beds for the  child and adolescent inpatient mental health program, ",Waterloo,Southwest,835 King St W,N2G 1G3,,"$64,581,893",,Yes,,Yes,,43.456239,-80.512077
52,Health care,Health,Kitchener,St Mary's General Hospital - Cardiac Catheterization Lab Expansion Project,Planning,July 2025,na,na,Waterloo,Southwest, 911 Queen's Blvd,N2M 1B2,,0,,Yes,,Yes,,43.43834977,-80.50173886
53,Health care,Health,London,St. Joseph's Health Care (London) - Parkwood Mental Health,Complete,December 2014,Parkwood / St. Thomas Mental Health,"New Brownfield facility at Parkwood site for longer-term mental health and at St. Thomas site for forensics. Parkwood Site: up to 156 beds in operation at opening; clinical programs, clinical support services, food and nutrition, education and learning, patient and family services, main pharmacy.  St. Thomas Site: up to 89 beds proposed; forensic psychiatric services, clinical support services, food and nutrition services, education and learning, patient and family services, satellite pharmacy.",Middlesex,Southwest,268 Grosvenor St,N6A 3N3,,"$1,090,049,817",,Yes,,Yes,,43.00086,-81.254367
54,Health care,Health,London,London Health Sciences Centre - Stem Cell Transplant Unit Expansion,Planning,January 2028,"Renovations to the stem cell transplant unit, logistical and support areas, associated spaces including inpatient pharmacy and ambulatory clinics and co-location of inpatient and transplant day unit areas.","Expansion of stem cell therapy capacity, and the creation of new outpatient and chemotherapy pharmacy spaces and expanded outpatient clinics.",Middlesex,Southwest,800 Commissioners Rd E,N6A 5W9,,0,,Yes,,Yes,,42.960931,-81.225729
55,Health care,Health,London,London Intercommunity Health Centre - Dundas Street Retro-Fit Leasehold Improvement Project,Planning,October 2027,This retrofit project will consolidate programs and services from 2 sites into one renovated building. ,"The project will address aging and inadequate infrastructure to support the delivery of primary care, chronic disease management, diabetes education, and  counselling services.",Middlesex,Southwest,1700 Dundas St Unit 1,N5W 3C9,,0,,Yes,,,,43.00282441,-81.18683482
56,Health care,Health,London,London Health Sciences Centre - Ambulatory Surgical Centre Expasion Phase 2,Planning,July 2025,na,na,Middlesex,Southwest,746 Baseline Rd E,N6C5Z2,,0,,Yes,,Yes,,42.96243674,-81.22763755
57,Health care,Health,Madawaska Valley,St Francis Memorial Hospital - Emergency Department Redevelopment,Planning,November 2025,na,na,Renfrew,East,7 St Francis Memorial Dr,K0J1B0,,0,,Yes,,Yes,,45.48213287,-77.69464306
58,Health care,Health,Manitoulin,Noojmowin Teg Health Centre Expansion,Complete,September 2016,"4,400 sq. ft.-addition to replace temporary buildings","New space for traditional healers, a traditional healing lodge and health care professionals.",Manitoulin,Northeast,48 Hillside Dr,P0P 1K0,,"$2,363,300",,Yes,,Yes,,45.811014,-81.706657
59,Health care,Health,Marathon,North of Superior Health Care Group (NOSH) - Wilson Memorial General Hospital Site LTC addition - Complex Continuing Care (CCC) Bed Relocation,Under construction,July 2025,na,na,Thunder Bay,Northwest,26 Peninsula Rd,P0T2E0,,"$3,133,600",,Yes,,Yes,,48.71909601,-86.37544639
