_id,Category,Supporting Ministry,Community,Project,Status,Target Completion Date,Description,Result,Area,Region,Address,Postal Code,Highway / Transit Line,Estimated Total Budget,Municipal Funding,Provincial Funding,Federal Funding,Other Funding,Website,Latitude,Longitude
116,Health care,Health,Toronto,Scarborough Health Network - Centenary Site Emergency -Department Redevelopment ,Planning,November 2027,New construction and renovations to expand the emergency department,Improved Emergency Department service capacity and quality,Toronto,Central,2867 Ellesmere Rd,M1E 4B9,,0,,Yes,,Yes,,43.780398,-79.204549
117,Health care,Health,Toronto,Princess Margaret Hospital - Stem Cell Transplant Phase 2 Expansion,Planning,March 2027,"Expansion of inpatient capacity by creating additional allogeneic  beds with HEPA filtration and positive pressurization; creation of a malignant hematology day hospital,  and expansion of ambulatory clinic space.",Increased capacity and  quality of existing services and reduction of out of country referrals,Toronto,Central,610 University Ave,M5G 2M9,,0,,Yes,,Yes,,43.658117,-79.390725
118,Health care,Health,Toronto,Centre For Addiction and Mental Health (CAMH) - Phase 1D Redevelopment,Under construction,December 2028,Construction of a new building to accommodate expanded inpatient capacity and ambulatory services for the forensic mental health program. ,Improved access to mental health and addiction services.,Toronto,Central,1000 Queen St. West,M6J 1H4,,"$1,500,031,500",,Yes,,Yes,,43.64385513,-79.41759389
119,Health care,Health,Toronto,North York General Hospital - Inpatient Redevelopment ,Planning,March 2030,"The project involves the construction of a new inpatient care tower to include new and expanded operating rooms, a new emergency department and increased inpatient bed capacity.  Renovations will also be undertaken in the existing building to expand support services, including medical device processing, laboratory and pharmacy. ","Increased access to expanded inpatient capacity and acute care services, as well as upgraded and modernized facilities to address growth and demand for services.",Toronto,Central,"4001 Leslie Street, ",M2K 1E1,,0,,Yes,,Yes,,43.76973258,-79.36323399
120,Health care,Health,Toronto,Scarborough Health Network - Birchmount (Phase 1a) Redevelopment,Planning,December 2032,Redevelopment and expansion of Scarborough Health Network's Birchmount site.,Service expansion and Improved access to upgraded and modernized facilities.,Toronto,Central,"3050 Lawrence Avenue East, ",M1E 4B9,,0,,Yes,,Yes,,43.75637111,-79.24697079
121,Health care,Health,Toronto,Sunnybrook Health Sciences Centre - Brain Sciences Centre,Under construction,2024,"The Brain Sciences Centre project includes the construction of a new, 3-storey building adjacent to the existing F-wing on the Bayview campus and renovations in the existing building.  ","Additional beds and increased program space, and infrastructure improvement.",Toronto,Central,2075 Bayview Ave,M4N 3M5,,"$60,000,000",,Yes,,Yes,,43.72302401,-79.37291782
122,Health care,Health,Toronto,The Hospital for Sick Children - Project Horizon,Planning,March 2033,"Construction of a new patient care tower and renovations to the atrium wing. The new and renovated areas will house critical care, surgery, bone marrow transplant, diagnostic imaging, specialty outpatient clinics, emergency, and surgical departments.","Better integration of emerging technology and innovations into improved models of patient care, and creation of additional capacity to meet projected growth forecasts.",Toronto,Central,555 University Avenue,M5G 1X8,,0,,Yes,,Yes,,43.65737,-79.387432
123,Health care,Health,Toronto,Unity Health (St. Joseph's Health Centre Toronto) - Major Capital Redevelopment Project,Planning,June 2032,"This major project will renovate existing space, and add new space",The project addresses aging infrastructure and adds new space to allow for progrm an service expansion. ,Toronto,Central,30 The Queensway,M6R 1B5,,0,,Yes,,Yes,,43.63977084,-79.45063273
124,Health care,Health,Toronto,North York General Hospital - Branson Site Reactivation Care Centre ,Complete,December 2022,The project involves renovations to the East Wing of the  Branson site to create a reactivation care centre to support Alternate Levels of Care patients.,"This project provides increased bed capacity for Alternative Level of Care patients, freeing up capacity for acute care patients.",Toronto,Central,4001 Leslie St,M2K 1E1,,"$40,000,000",,Yes,,Yes,,43.76973258,-79.36323399
125,Health care,Health,Toronto,Toronto Western Hospital - New Patient Care Tower,Under construction,December 2027,Proposed new patient care tower at the Toronto Western Hospital Site that would add more beds and increase operating room capacity.,"Increased bed capacity and increased operating room capacity, while addressing aging infrastructure. Also allows for relocation of mental health beds from Toronto General to Toronto Western for the consolidation of mental health services.",Toronto,Central,399 Bathurst St,M5T 2S8,,"$484,211,847",,Yes,,Yes,,43.653386,-79.405942
126,Health care,Health,Toronto,Scarborough Health Network - Birchmount Site-Emergency Department Renovation and Expansion,Planning,December 2027,Redevelopment and expansion of the Emergency Department to achieve current standards and to provide physical capacity to manage current demand and future growth.,Reduce ED wait times and address hallway medicine.,Toronto,Central,3030 Birchmount Rd.,M1W 3W3,,0,,Yes,,Yes,,43.80238988,-79.30885107
127,Health care,Health,Toronto,University Health Network - Stem Cell Transplant Phase 2 Expansion Head Start Project,Planning,March 2027,The proposed Stem Cell Transplant Phase Two Expansion Project at the University Health Network's Princess Margaret Cancer Centre aims to accelerate the renovations to the existing allogeneic transplant unit on the 14th floor and the creation of a new inpatient unit on the 15th floor. ,Increased bed capacity. Improved infrastructure (HVAC) for the existing allogeneic transplant unit on the 14th floor.,Toronto,Central,610 University Ave,M5G 2M9,,0,,Yes,,Yes,,43.658248,-79.390683
128,Health care,Health,Toronto,Anishnawbe Health Toronto - New Aboriginal Community Health Centre Facility Project,Under construction,2024,The project involves construction of a new building located in Toronto’s West Don Lands.  ,"This project will result in program expansion, improved access to care, and the improvement of clinical services",Toronto,Central,225 Queen Street East,M5A 1S4,,"$31,402,200",,Yes,,Yes,,43.65678247,-79.37064562
129,Health care,Health,Toronto,Flemingdon Health Centre - Health Access Thorncliffe Park (HATP) - Thorncliffe Park Community Hub,Under construction,August 2024,This project at the East York Town Centre will create an integrated and multi-service hub to provide a range of medical and communcity care programs and services. ,"The new multi-care service hub will provide  primary health care, chronic disease management, immigrant services, mental health care, maternal reproductive healthcare, as well as newborn, child and youth services.",Toronto,Central,10 Gateway Blvd.,M3C 3A1,,"$16,372,200",,Yes,,Yes,,43.71041158,-79.33221019
130,Health care,Health,Toronto,The Four Villages Community Health Centre - Four Villages CHC Site Relocation Project,Planning,June 2026,This project will relocate the existing Community Health Centre.,"This project will address aging infrastructure, poor physical condition and the space limitations of the existing facilitiy.  The new faciility will improved service quality and allow for program growth.",Toronto,Central,1700 Bloor Street West,M6P 4C3,,0,,Yes,,,,43.66676034,-79.48656337
131,Health care,Health,Toronto,"Ontario Agency For Health Protection And Promotion - Operational Support Facility and Bio-Repository Centre, Warehouse Project",Planning,To Be Determined,na,na,Toronto,Central,81 Resources Rd,M9P 3T1,,0,,Yes,,,,43.71154042,-79.54514663
132,Health care,Health,Toronto,Unity Health (St Joseph's Health Centre Toronto) - Unity Health Toronto: St. Joseph's Health Centre Site - 21 Bed Reactivation Care Unit Renovation (Glendale Wing).,Under construction,December 2024,na,na,Toronto,Central,30 The Queensway,M6R 1B5,,"$12,948,000",,Yes,,Yes,,43.63977084,-79.45063273
133,Health care,Health,Toronto,The Hospital for Sick Children - Blood and Marrow Transplant (BMT) Unit Renovations and Expansion Project,Under construction,December 2024,na,na,Toronto,Central,555 University Avenue,M5G 1X8,,"$12,477,700",,Yes,,Yes,,43.65737,-79.387432
134,Health care,Health,Toronto,The Hospital for Sick Children - Burton Wing Floors 9 & 10 Demolition - Early Works,Under construction,2024,na,na,Toronto,Central,555 University Avenue,M5G 1X8,,"$3,925,100",,Yes,,Yes,,43.65737,-79.387432
135,Health care,Health,Toronto,Unity Health (St Michael's Hospital) - Neonatal Intensive Care Unit (NICU) Redevelopment Project,Planning,January 2028,na,na,Toronto,Central,30 Bond St,M5B 1W8,,0,,Yes,,Yes,,43.65367,-79.377729
136,Health care,Health,Toronto,University Health Network - Hillcrest Reactivation Centre,Under construction,2024,na,na,Toronto,Central,47 Austin Terrace,M5R 1Y8,,"$12,066,400",,Yes,,,,43.67781019,-79.41569899
137,Health care,Health,Toronto,Scarborough Health Network - Early Works - General Site Hemodialysis Isolation Unit,Planning,May 2025,na,na,Toronto,Central,3050 Lawrence Ave E,M1P 2V5,,0,,Yes,,Yes,,43.756193,-79.246939
138,Health care,Health,Toronto,Scarborough Health Network - Early Works - Centenary Site New Dialysis Unit,Planning,May 2025,na,na,Toronto,Central,2867 Ellesmere Rd,M1E 4B9,,0,,Yes,,Yes,,43.780398,-79.204549
139,Health care,Health,Toronto,The Hospital for Sick Children - Acuity Adaptable Beds (Interim Relief Beds) Head Start Project,Planning,December 2027,na,na,Toronto,Central,555 University Avenue,M5G 1X8,,0,,Yes,,Yes,,43.65737,-79.387432
140,Health care,Health,Toronto,The Hospital for Sick Children - Electrical Switchgear Room Relocation Head Start Project,Under construction,June 2025,na,na,Toronto,Central,555 University Avenue,M5G 1X8,,"$24,645,300",,Yes,,Yes,,43.65737,-79.387432
141,Health care,Health,Toronto,The Hospital for Sick Children - Offsite Distribution & Storage Facility (ODSF) - Early Works,Under construction,December 2024,na,na,Toronto,Central,555 University Avenue,TBD,,"$34,177,500",,Yes,,Yes,,43.65737,-79.387432
142,Health care,Health,Toronto,Unity Health (St Michael's Hospital) - Men's Withdrawal Management Services,Under construction,2024,na,na,Toronto,Central,135 Sherbourne St,M5A 2S5,,"$18,409,700",,Yes,,,,43.6553757,-79.36928933
143,Health care,Health,Toronto,Scarborough Health Network - Reactivation Care Centre (RCC),Planning,March 2025,na,na,Toronto,Central,2881 Eglinton Ave E #200,M1J 0A2,,0,,Yes,,Yes,,43.74085241,-79.23931666
144,Health care,Health,Toronto,University Health Network - Reactivation Care Centre,Planning,December 2024,na,na,Toronto,Central,47 Austin Terrace,M5R 1Y8,,0,,Yes,,Yes,,43.67781019,-79.41569899
145,Health care,Health,Trent Hills,Campbellford Memorial Hospital - Heating Ventilation and Air Conditioning (HVAC) and Emergency Generator Replacement Project,Under construction,December 2024,na,na,Northumberland,East,146 Oliver Rd,K0L 1L0,,"$9,639,900",,Yes,,,,44.31259472,-77.79010818
146,Health care,Health,Vaughan,Mackenzie Health - New Vaughan Hospital (formerly York Central Hospital),Complete,August 2020,Construction of a new hospital to be located in Vaughan and to become the second site of a two-site hospital model for Mackenzie Health,"Expanded services (e.g. acute inpatient and intensive care beds, emergency, surgical, and surgery, diagnostic imaging services) and fully integrated smart technology (first of its kind in Canada)",York,Central,3200 Major Mackenzie Drive West,L4H 3T6,,"$1,352,636,500",,Yes,,Yes,,43.83562,-79.53245
147,Health care,Health,Wasaga Beach,South Georgian Bay Community Health Centres - New Build,Planning,March 2026,Construction of a new purpose-built facility in Wasaga Beach.,"This project will provide increased program and service space, improve health, safety and infection control for patients and staff and provide multi-service space to deliver integrated programs and services.",Simcoe,Central,14 Ramblewood Dr #202,L9Z 0C4,,0,,Yes,,,,44.46854103,-80.0757246
148,Health care,Health,Wellington North,North Wellington Health Care Corporation - ER/Ambulatory Care Project,Complete,August 2021,Redevelopment of the Emergency Department and Ambulatory Care areas . The project also includes the creation space for the Medical Education Facilities at both the Mount Forest and Palmerston sites.  The project will accommodate increased visits to the Emergency Department and Ambulatory Care areas.,Expansion of sevice capacity and infrastructure improvement.,Wellington,Southwest,Wellington North,N0G 2L3,,"$18,496,700",,Yes,,Yes,,43.974446,-80.738127
149,Health care,Health,Whitby,Ontario Shores Centre For Mental Health Sciences - Priority Capital Needs Project,Under construction,December 2024,na,na,Durham,Central,700 Gordon St,L1N 5S9,,"$25,042,500",,Yes,,Yes,,43.8479324,-78.9453908
150,Health care,Health,Windsor,Windsor Hotel Dieu Grace - Cardiac Catheritization Lab Project,Planning,December 2025,Relocation and expansion of the current cardiac catheterization lab in order to implement a 2-Cath table model of care that would enable provision of 24-hour Cath Lab services.   unit to two labs and relocating the day surgery program,Improved access to 24/7 cath lab services; improved continuum of care for cardiac patients; reduced transfers to alternate healthcare facilities in the United States.,Essex,Southwest,1030 Ouellette Avenue,N9A 1E1,,0,,Yes,,Yes,,42.308328,-83.031589
151,Health care,Health,Windsor,Windsor Regional Hospital - New Windsor-Essex Regional Hospital,Planning,June 2033,The new Windsor-Essex hospital will be a multi-level community-based acute care facility with an array of programs and services on a greenfield site.,"Expansion of service, improvement of infrastructure and access to health care services for residents in the Windsor-Essex region.",Essex,Southwest,County Rd 42 / Concession Rd 9 ,N9A 1E1,,0,,Yes,,Yes,,42.270143,-82.928011
152,Health care,Health,Windsor,Hotel-Dieu Grace Healthcare - Mental Health Inpatient Bed Expansion,Planning,April 2031,Renovations at the Tayfour site to facilitate program expansion and the transfer of mental health beds from Windsor Regional Hospital,Improved access to mental health services for area residents,Essex,Southwest,"1453 Prince Road, ",N9C 3Z4,,0,,Yes,,Yes,,42.28577413,-83.0630823
153,Health care,Health,Windsor,Windsor Regional Hospital - LINAC Expansion Project,Under construction,April 2025,na,na,Essex,Southwest,1995 Lens Ave,N8W 1L9,,"$12,247,300",,Yes,,Yes,,42.3017632,-82.99761452
154,Health care,Health,Woodstock,Oxford County Community Health Centre - Leasehold Improvement Project,Planning,February 2025,Renovation of space at the Woodstock location.,"This project will bring space up to current design standards, and address current infrastructure quality problems.",Oxford,Southwest,"35 Metcalf Street, Unit 301, Woodstock, ON",N4S 3E6,,0,,Yes,,,,43.12908925,-80.7562584
155,Health care,Health,York,Humber River Hospital - Acute Behavioural Assessment and Management Unit (ABAMU),Planning,March 2025,na,na,York,Central,200 Church St,M9N 1N8,,0,,Yes,,Yes,,43.70931569,-79.51016477
156,Health care,Northern Development,Greater Sudbury,St. Joseph's Health Centre Long Term Care ,Complete,February 2015,Construction of new building,"128 long-term care beds, café, gathering areas and hair salon",Sudbury,Northeast,4690 Municipal Rd 15,P0M 1L0,,"$21,500,000",,Yes,,Yes,http://www.sjsudbury.com/index.php/villa-st-gabriel-villa/,46.650168,-80.943734
157,Health care,Northern Development,Nipissing District,Nipissing Serenity Hospice,Complete,May 2022,Construct a 10-bed hospice.,,Parry Sound,Northeast,799 John Street,P1B 8T2,,"$8,000,000",Yes,Yes,,,,,
158,Health care,Northern Development,Nipissing District,"Algonquin Nursing Home - New Respite Care Services, Hospice Suite and Indigenous Healing Room",Complete,January 2020,"The Rural Health Hub project was initiated as a result of the Ministry of Health and Long Term Care's approval to award the Algonquin Nursing Home $15,000,000 to relocate and reconstruct the home on the Mattawa Hospital site. Project consist of the capital construction (7080 sf) and equipment costs associated with the addition of the following services on the existing hospital site, in concert with the relocation and construction of the new Algonquin Nursing Home.",Construction of a health hub and 1 hospice bed.,Parry Sound,Northeast,217 Turcotte Park Road,P0V 1V0,,"$18,700,000",,Yes,,Yes,,46.3110936,-78.7134417
159,Health care,Northern Development,Red Lake,Red Lake Hospital Indigenous Fire Circle,Complete,August 2021,Build a sitting area around a fire circle at the Red Lake Hospital. ,To help patients' and family wellbeing when visiting the hospital. ,Kenora,Northwest,51 Hwy. 105,P0V 2M0,,"$11,100",Yes,Yes,,,,51.0122,-93.82284
160,Health care,Northern Development,Thunder Bay,Thunder Bay Regional Health Sciences Centre Regional Data Centre,Complete,December 2018,Relocation and expansion of data centre,"New 4,500-sq. ft data centre to provide improved health-care data management services for all hospitals in Northern Ontario.",Thunder Bay,Northwest,1040 Oliver Rd.,P7B 6V4,,"$4,693,170",,Yes,Yes,Yes,,48.42,-89.26
161,Health care,Northern Development,Whitestone,Nurse Practitioner-Led Clinic (NPLC) Expansion (formerly Whitestone and Area Nursing Station),Complete,October 2023,"The Recipient will renovate and expand the existing 1500 square foot Nurse Practitioner-Led Clinic building in the Municipality of Whitestone, which will result in an additional 1000 square feet at grade and an additional 1000 square feet below grade.","The project will result in three new patient care rooms, a larger waiting area and reception area, a full kitchen, a staff meeting room, a private office for the managing nurse practitioner, additional storage space, and a suite for visiting nurse practitioners or students.",Parry Sound,Northeast,11 Church Street,P0A 1G0,,0,Yes,Yes,Yes,Yes,,45.64481068,-79.85402532
